<?xml version="1.0" encoding="UTF-8"?>
<!--W3C Schema generated by XML Spy v3.5 NT (http://www.xmlspy.com)-->
<xsd:schema xmlns:xsd="http://www.w3.org/2000/10/XMLSchema" elementFormDefault="qualified">

	<xsd:element name="ontology">
		<xsd:complexType>
			<xsd:sequence>
				<xsd:element name="conceptType" maxOccurs="unbounded" type="ontologyType"/>
				<xsd:element name="relationType" maxOccurs="unbounded" type="relationType"/>
			</xsd:sequence>
			<xsd:attribute name="top" type="xsd:string" use="required"/>
		</xsd:complexType>
	</xsd:element>

	<xsd:complexType name="ontologyType">
		<xsd:sequence>
				<xsd:element name="description" minOccurs="0" maxOccurs="1"  type="xsd:string"/>
				<xsd:element name="synonym" minOccurs="0" maxOccurs="unbounded" type="xsd:string"/>
				<xsd:element name="relationship" minOccurs="0" maxOccurs="unbounded">
					<xsd:complexType>
						<xsd:attribute name="type" use="required" type="xsd:string"/>
						<xsd:attribute name="to" use="required" />
					</xsd:complexType>
				</xsd:element>
		</xsd:sequence>
		<xsd:attribute name="name" use="required" type="xsd:string"/>
		<xsd:attribute name="creator" type="xsd:string"/>
	</xsd:complexType>
	
	<xsd:complexType name="relationType">
		<xsd:complexContent>
			<xsd:extension base="ontologyType">
				<xsd:attribute name="domain" type="xsd:string"/>
				<xsd:attribute name="range" type="xsd:string"/>
			</xsd:extension>	
		</xsd:complexContent>
	</xsd:complexType>
</xsd:schema>
